{
  "id": "versioning.UnsupportedProtocolVersion.version.no-overlap",
  "behaviorIds": [
    "versioning.UnsupportedProtocolVersion.version.no-overlap"
  ],
  "description": "Negative/error-path: initialize with protocolVersions:[\"999.0.0\"] returns error.code===-32005 and error.data.supportedVersions is a non-empty string array. Client surfaces JSON-RPC error code -32005.",
  "protocolVersion": "0.3.0",
  "notes": "Auto-generated from D7 negative paths: versioning.UnsupportedProtocolVersion.version.no-overlap. When protocolVersions contains no version the server can speak, server MUST return -32005. data MUST include supportedVersions.",
  "steps": [
    {
      "op": "client.request",
      "label": "send initialize to trigger the error condition",
      "method": "initialize",
      "params": {
        "protocolVersions": [
          "999.0.0"
        ],
        "clientId": "test-client"
      },
      "id": 1
    },
    {
      "op": "server.response",
      "label": "server returns error code -32005",
      "forId": 1,
      "error": {
        "code": -32005,
        "message": "Error: error:UnsupportedProtocolVersion"
      }
    },
    {
      "op": "client.assert.error",
      "label": "client surfaces error code -32005",
      "code": -32005
    }
  ]
}
