{
  "id": "action.terminal-commandExecuted.happy.terminal-commandexecuted-appends-part",
  "behaviorIds": [
    "action.terminal-commandExecuted.happy.terminal-commandexecuted-appends-part"
  ],
  "description": "Reducer fixture: terminal/commandExecuted appends a command part and sets supportsCommandDetection. Verifies that the client's terminal reducer converges to the expected state after applying the fixture's action(s).",
  "protocolVersion": "0.3.0",
  "pinClock": 9999,
  "notes": "Auto-generated from types/test-cases/reducers/119-terminal-commandexecuted-appends-part.json. Reducer: terminal.",
  "steps": [
    {
      "op": "client.request",
      "label": "initialize — seed channel with fixture initial state",
      "method": "initialize",
      "params": {},
      "id": 1
    },
    {
      "op": "server.response",
      "label": "initialize result carries the fixture initial state as a snapshot",
      "forId": 1,
      "result": {
        "protocolVersion": "0.3.0",
        "serverSeq": 0,
        "snapshots": [
          {
            "resource": "ahp-session:/test-session",
            "fromSeq": 0,
            "state": {
              "title": "bash",
              "content": [],
              "claim": {
                "kind": "client",
                "clientId": "c1"
              }
            }
          }
        ]
      }
    },
    {
      "op": "server.notify",
      "label": "action: terminal/commandExecuted",
      "method": "action",
      "params": {
        "channel": "ahp-session:/test-session",
        "action": {
          "type": "terminal/commandExecuted",
          "commandId": "cmd-1",
          "commandLine": "npm test",
          "timestamp": 1700000000000
        },
        "serverSeq": 1,
        "origin": null
      }
    },
    {
      "op": "client.assert.state",
      "label": "client-reduced state converges to fixture expected state",
      "channel": "ahp-session:/test-session",
      "equals": {
        "title": "bash",
        "content": [
          {
            "type": "command",
            "commandId": "cmd-1",
            "commandLine": "npm test",
            "output": "",
            "timestamp": 1700000000000,
            "isComplete": false
          }
        ],
        "claim": {
          "kind": "client",
          "clientId": "c1"
        },
        "supportsCommandDetection": true
      }
    }
  ]
}
