{
  "id": "action.session-truncated.happy.session-truncated-clears-all-when-turnid-omitted",
  "behaviorIds": [
    "action.session-truncated.happy.session-truncated-clears-all-when-turnid-omitted"
  ],
  "description": "Reducer fixture: session/truncated clears all when turnId omitted. Verifies that the client's session reducer converges to the expected state after applying the fixture's action(s).",
  "protocolVersion": "0.3.0",
  "pinClock": 9999,
  "notes": "Auto-generated from types/test-cases/reducers/066-session-truncated-clears-all-when-turnid-omitted.json. Reducer: session.",
  "steps": [
    {
      "op": "client.request",
      "label": "initialize — seed channel with fixture initial state",
      "method": "initialize",
      "params": {},
      "id": 1
    },
    {
      "op": "server.response",
      "label": "initialize result carries the fixture initial state as a snapshot",
      "forId": 1,
      "result": {
        "protocolVersion": "0.3.0",
        "serverSeq": 0,
        "snapshots": [
          {
            "resource": "ahp-session:/test-session",
            "fromSeq": 0,
            "state": {
              "summary": {
                "resource": "copilot:/test-session",
                "provider": "copilot",
                "title": "Test Session",
                "status": 1,
                "createdAt": 1000,
                "modifiedAt": 1000
              },
              "lifecycle": "ready",
              "turns": [
                {
                  "id": "t1",
                  "message": {
                    "text": "First",
                    "origin": {
                      "kind": "user"
                    }
                  },
                  "responseParts": [],
                  "usage": null,
                  "state": "complete"
                },
                {
                  "id": "t2",
                  "message": {
                    "text": "Second",
                    "origin": {
                      "kind": "user"
                    }
                  },
                  "responseParts": [],
                  "usage": null,
                  "state": "complete"
                },
                {
                  "id": "t3",
                  "message": {
                    "text": "Third",
                    "origin": {
                      "kind": "user"
                    }
                  },
                  "responseParts": [],
                  "usage": null,
                  "state": "complete"
                }
              ]
            }
          }
        ]
      }
    },
    {
      "op": "server.notify",
      "label": "action: session/truncated",
      "method": "action",
      "params": {
        "channel": "ahp-session:/test-session",
        "action": {
          "type": "session/truncated"
        },
        "serverSeq": 1,
        "origin": null
      }
    },
    {
      "op": "client.assert.state",
      "label": "client-reduced state converges to fixture expected state",
      "channel": "ahp-session:/test-session",
      "equals": {
        "summary": {
          "resource": "copilot:/test-session",
          "provider": "copilot",
          "title": "Test Session",
          "status": 1,
          "createdAt": 1000,
          "modifiedAt": 9999
        },
        "lifecycle": "ready",
        "turns": [],
        "activeTurn": null
      }
    }
  ]
}
