{
  "id": "action.session-responsePart.happy.session-reasoning-appends-reasoning-content",
  "behaviorIds": [
    "action.session-responsePart.happy.session-reasoning-appends-reasoning-content"
  ],
  "description": "Reducer fixture: session/reasoning appends reasoning content. Verifies that the client's session reducer converges to the expected state after applying the fixture's action(s).",
  "protocolVersion": "0.3.0",
  "pinClock": 9999,
  "notes": "Auto-generated from types/test-cases/reducers/032-session-reasoning-appends-reasoning-content.json. Reducer: session.",
  "steps": [
    {
      "op": "client.request",
      "label": "initialize — seed channel with fixture initial state",
      "method": "initialize",
      "params": {},
      "id": 1
    },
    {
      "op": "server.response",
      "label": "initialize result carries the fixture initial state as a snapshot",
      "forId": 1,
      "result": {
        "protocolVersion": "0.3.0",
        "serverSeq": 0,
        "snapshots": [
          {
            "resource": "ahp-session:/test-session",
            "fromSeq": 0,
            "state": {
              "summary": {
                "resource": "copilot:/test-session",
                "provider": "copilot",
                "title": "Test Session",
                "status": 8,
                "createdAt": 1000,
                "modifiedAt": 2000
              },
              "lifecycle": "ready",
              "turns": [],
              "activeTurn": {
                "id": "turn-1",
                "message": {
                  "text": "Hello",
                  "origin": {
                    "kind": "user"
                  }
                },
                "responseParts": [],
                "usage": null
              }
            }
          }
        ]
      }
    },
    {
      "op": "server.notify",
      "label": "action: session/responsePart",
      "method": "action",
      "params": {
        "channel": "ahp-session:/test-session",
        "action": {
          "type": "session/responsePart",
          "turnId": "turn-1",
          "part": {
            "kind": "reasoning",
            "id": "r-1",
            "content": ""
          }
        },
        "serverSeq": 1,
        "origin": null
      }
    },
    {
      "op": "server.notify",
      "label": "action: session/reasoning",
      "method": "action",
      "params": {
        "channel": "ahp-session:/test-session",
        "action": {
          "type": "session/reasoning",
          "turnId": "turn-1",
          "partId": "r-1",
          "content": "Thinking about "
        },
        "serverSeq": 2,
        "origin": null
      }
    },
    {
      "op": "server.notify",
      "label": "action: session/reasoning",
      "method": "action",
      "params": {
        "channel": "ahp-session:/test-session",
        "action": {
          "type": "session/reasoning",
          "turnId": "turn-1",
          "partId": "r-1",
          "content": "the answer"
        },
        "serverSeq": 3,
        "origin": null
      }
    },
    {
      "op": "client.assert.state",
      "label": "client-reduced state converges to fixture expected state",
      "channel": "ahp-session:/test-session",
      "equals": {
        "summary": {
          "resource": "copilot:/test-session",
          "provider": "copilot",
          "title": "Test Session",
          "status": 8,
          "createdAt": 1000,
          "modifiedAt": 2000
        },
        "lifecycle": "ready",
        "turns": [],
        "activeTurn": {
          "id": "turn-1",
          "message": {
            "text": "Hello",
            "origin": {
              "kind": "user"
            }
          },
          "responseParts": [
            {
              "kind": "reasoning",
              "id": "r-1",
              "content": "Thinking about the answer"
            }
          ],
          "usage": null
        }
      }
    }
  ]
}
